<?xml version="1.0" encoding="UTF-8"?>
<!DOCTYPE config SYSTEM "configuration.dtd">
<config>
	<database>
		<id>WinTest</id>
		<path>C:\temp</path>
	</database>
	<alert>
		<class>mon.evt.StdoutAlert</class>
		<properties>
			<property name="init.msg"></property>
			<property name="send.pre">ERROR></property>
		</properties>
	</alert>
	<logfile>
		<!-- Start position at current or begin -->
		<file start="begin">C:\temp\test.log</file>
		<pattern>
			<regex>Test(.*)</regex>
			<msg>Testevent => $1</msg>
			<severity>WARNING</severity>
			<condition>doc/examples/wintest.js</condition>
			<properties>
				<property name="send.slot.mgi_eventkey">$1</property>
				<property name="send.slot.mgi_eventsubkey">Das ist ein EventSubKey</property>
			</properties>
		</pattern>
		<pattern>
			<regex>.*Error(.*)</regex>
			<msg>Error: $1</msg>
			<severity>CRITICAL</severity>
		</pattern>
	</logfile>
</config>