<?xml version="1.0" encoding="UTF-8"?>
<!DOCTYPE config SYSTEM "configuration.dtd">
<config>
	<database>
		<id>LinuxBase</id>
		<pid>pid</pid>
	</database>
	<alert>
		<class>mon.evt.StdoutAlert</class>
		<properties>
			<property name="init.msg"></property>
			<property name="send.pre">ERROR></property>
		</properties>
	</alert>
	<logfile>
		<file start="current">/tmp/test.log</file>
		<pattern>
			<regex>.*Error:(.*)</regex>
			<msg>Error: $1</msg>
			<severity>WARNING</severity>
			<condition>test.js</condition>
		</pattern>
	</logfile>
</config>
